{
  "schema_version": "1.0.0",
  "record_type": "routine",
  "public_id": "stress-test-analysis",
  "record_uri": "trajectory://routine/stress-test-analysis",
  "evidence_grade": "equivalent_predecessor",
  "source_revision_relation": "predecessor",
  "summary": "Representative predecessor evidence covers result-blind design lanes, candidate freeze, two blind reviews, admissibility, isolated execution, and result mapping.",
  "status": "completed_with_limits",
  "outcome": "robustness_ready_with_limits",
  "proves_current_revision_end_to_end_completion": false,
  "timestamps": {
    "started_at_utc": "2026-08-29T15:26:51Z",
    "finished_at_utc": "2026-08-29T16:47:45Z"
  },
  "step_order": [
    {
      "position": 1,
      "public_step_id": "freeze-sensitivity-contract",
      "status": "represented"
    },
    {
      "position": 2,
      "public_step_id": "design-data-measurement-lane",
      "status": "represented"
    },
    {
      "position": 3,
      "public_step_id": "design-model-lane",
      "status": "represented"
    },
    {
      "position": 4,
      "public_step_id": "design-inference-lane",
      "status": "represented"
    },
    {
      "position": 5,
      "public_step_id": "rank-sensitivity-candidates",
      "status": "represented"
    },
    {
      "position": 6,
      "public_step_id": "review-candidates-alpha",
      "status": "represented"
    },
    {
      "position": 7,
      "public_step_id": "review-candidates-beta",
      "status": "represented"
    },
    {
      "position": 8,
      "public_step_id": "resolve-candidate-admissibility",
      "status": "represented"
    },
    {
      "position": 9,
      "public_step_id": "execute-approved-candidates",
      "status": "represented"
    },
    {
      "position": 10,
      "public_step_id": "build-robustness-map",
      "status": "represented"
    }
  ],
  "retry_count": null,
  "correction_count": 1,
  "handoffs": {
    "received_from": [
      "reproduce-original-result"
    ],
    "delivered_to": [
      "verify-and-adjudicate-findings"
    ]
  },
  "input_classes": [
    "frozen_study_case",
    "reproduction_package",
    "scientific_policy"
  ],
  "bounded_errors": [],
  "output_artifact_kinds": [
    "robustness_map"
  ],
  "schema_status": "not_reported",
  "integrity": {
    "algorithm": null,
    "evidence_id": null,
    "hash_match": null
  },
  "release_limitations": [
    "predecessor_revision_only",
    "visible_nonblocking_gaps"
  ],
  "redactions_applied": [
    "research_content_removed",
    "identity_details_removed",
    "runtime_metadata_removed",
    "interaction_content_removed",
    "local_identifiers_replaced",
    "integrity_values_replaced",
    "uncleared_artifacts_removed"
  ],
  "contains_research_payload": false,
  "contains_session_metadata": false
}
