{
  "schema_version": "1.0.0",
  "record_type": "agent",
  "public_id": "claim-bounty-verification/source-evidence-verifier",
  "record_uri": "trajectory://agent/claim-bounty-verification/source-evidence-verifier",
  "evidence_grade": "exact",
  "source_revision_relation": "current",
  "summary": "Produced current supplied-document consistency findings under the bounded intake scope.",
  "status": "represented",
  "outcome": null,
  "proves_current_revision_end_to_end_completion": false,
  "timestamps": {
    "started_at_utc": null,
    "finished_at_utc": null
  },
  "step_order": [
    {
      "position": 1,
      "public_step_id": "verify-document-consistency",
      "status": "represented"
    }
  ],
  "retry_count": null,
  "correction_count": null,
  "handoffs": {
    "received_from": [
      "claim-bounty-reproduction/reproduction-engineer"
    ],
    "delivered_to": [
      "claim-bounty-intake/claim-mapper"
    ]
  },
  "input_classes": [
    "sanitized_workflow_state"
  ],
  "bounded_errors": [],
  "output_artifact_kinds": [
    "document_consistency_findings"
  ],
  "schema_status": "not_reported",
  "integrity": {
    "algorithm": null,
    "evidence_id": null,
    "hash_match": null
  },
  "release_limitations": [
    "later_verification_represented_by_predecessor"
  ],
  "redactions_applied": [
    "research_content_removed",
    "identity_details_removed",
    "runtime_metadata_removed",
    "interaction_content_removed",
    "local_identifiers_replaced",
    "integrity_values_replaced",
    "uncleared_artifacts_removed"
  ],
  "contains_research_payload": false,
  "contains_session_metadata": false
}
