{
  "schema_version": "1.0.0",
  "record_type": "routine",
  "public_id": "research-methods-and-evidence",
  "record_uri": "trajectory://routine/research-methods-and-evidence",
  "evidence_grade": "equivalent_predecessor",
  "source_revision_relation": "predecessor",
  "summary": "Representative predecessor evidence resumed a bounded extraction after timeout, repaired stale provenance, and assembled a limited evidence package.",
  "status": "completed_with_limits",
  "outcome": "evidence_ready_with_limits",
  "proves_current_revision_end_to_end_completion": false,
  "timestamps": {
    "started_at_utc": null,
    "finished_at_utc": "2026-08-29T17:27:05.264Z"
  },
  "step_order": [
    {
      "position": 1,
      "public_step_id": "freeze-research-brief",
      "status": "represented"
    },
    {
      "position": 2,
      "public_step_id": "search-screen-slice-sources",
      "status": "represented"
    },
    {
      "position": 3,
      "public_step_id": "map-full-text-source-1",
      "status": "represented"
    },
    {
      "position": 4,
      "public_step_id": "map-full-text-source-2",
      "status": "represented"
    },
    {
      "position": 5,
      "public_step_id": "map-full-text-source-3",
      "status": "represented"
    },
    {
      "position": 6,
      "public_step_id": "assemble-targeted-evidence",
      "status": "represented"
    }
  ],
  "retry_count": 1,
  "correction_count": 1,
  "handoffs": {
    "received_from": [
      "reproduce-original-result"
    ],
    "delivered_to": [
      "verify-and-adjudicate-findings"
    ]
  },
  "input_classes": [
    "frozen_study_case",
    "reproduction_package",
    "research_policy"
  ],
  "bounded_errors": [
    {
      "code": "bounded_extraction_timeout",
      "summary": "A bounded extraction timed out and resumed from the frozen map."
    },
    {
      "code": "stale_provenance_repaired",
      "summary": "A stale publication chain was corrected through one writer."
    }
  ],
  "output_artifact_kinds": [
    "literature_evidence_package"
  ],
  "schema_status": "not_reported",
  "integrity": {
    "algorithm": null,
    "evidence_id": null,
    "hash_match": null
  },
  "release_limitations": [
    "predecessor_revision_only",
    "visible_source_limits"
  ],
  "redactions_applied": [
    "research_content_removed",
    "identity_details_removed",
    "runtime_metadata_removed",
    "interaction_content_removed",
    "local_identifiers_replaced",
    "integrity_values_replaced",
    "uncleared_artifacts_removed"
  ],
  "contains_research_payload": false,
  "contains_session_metadata": false
}
