{
  "schema_version": "1.0.0",
  "record_type": "agent",
  "public_id": "claim-bounty-intake/claim-mapper",
  "record_uri": "trajectory://agent/claim-bounty-intake/claim-mapper",
  "evidence_grade": "exact",
  "source_revision_relation": "current",
  "summary": "Validated bounded documents, preserved a conflict, and bound the frozen study case.",
  "status": "represented",
  "outcome": null,
  "proves_current_revision_end_to_end_completion": false,
  "timestamps": {
    "started_at_utc": null,
    "finished_at_utc": null
  },
  "step_order": [
    {
      "position": 1,
      "public_step_id": "validate-claim-map-documents",
      "status": "represented"
    },
    {
      "position": 2,
      "public_step_id": "bind-and-freeze-analysis",
      "status": "represented"
    }
  ],
  "retry_count": null,
  "correction_count": null,
  "handoffs": {
    "received_from": [
      "claim-bounty-operations/claimbounty-orchestrator",
      "claim-bounty-intake/variable-mapper",
      "claim-bounty-verification/source-evidence-verifier"
    ],
    "delivered_to": [
      "claim-bounty-reproduction/reproduction-engineer"
    ]
  },
  "input_classes": [
    "sanitized_workflow_state"
  ],
  "bounded_errors": [],
  "output_artifact_kinds": [
    "frozen_study_case"
  ],
  "schema_status": "not_reported",
  "integrity": {
    "algorithm": null,
    "evidence_id": null,
    "hash_match": null
  },
  "release_limitations": [
    "nonblocking_document_conflict"
  ],
  "redactions_applied": [
    "research_content_removed",
    "identity_details_removed",
    "runtime_metadata_removed",
    "interaction_content_removed",
    "local_identifiers_replaced",
    "integrity_values_replaced",
    "uncleared_artifacts_removed"
  ],
  "contains_research_payload": false,
  "contains_session_metadata": false
}
