{
  "schema_version": "1.0.0",
  "record_type": "routine",
  "public_id": "assemble-final-audit",
  "record_uri": "trajectory://routine/assemble-final-audit",
  "evidence_grade": "equivalent_predecessor",
  "source_revision_relation": "predecessor",
  "summary": "Representative predecessor evidence built canonical and rendered outputs, corrected renderer selection, confirmed matching renders, and completed a clean replay.",
  "status": "completed_with_limits",
  "outcome": "audit_completed_with_limits",
  "proves_current_revision_end_to_end_completion": false,
  "timestamps": {
    "started_at_utc": null,
    "finished_at_utc": null
  },
  "step_order": [
    {
      "position": 1,
      "public_step_id": "build-canonical-audit",
      "status": "represented"
    },
    {
      "position": 2,
      "public_step_id": "render-researcher-html",
      "status": "represented"
    },
    {
      "position": 3,
      "public_step_id": "check-and-package-audit",
      "status": "represented"
    }
  ],
  "retry_count": null,
  "correction_count": 1,
  "handoffs": {
    "received_from": [
      "verify-and-adjudicate-findings"
    ],
    "delivered_to": [
      "run-claimbounty-scientific-audit"
    ]
  },
  "input_classes": [
    "adjudication_package",
    "manuscript_recommendations",
    "audit_schema"
  ],
  "bounded_errors": [
    {
      "code": "renderer_selection_corrected",
      "summary": "A renderer selection mismatch was corrected."
    }
  ],
  "output_artifact_kinds": [
    "audit_json",
    "audit_html",
    "replay_package",
    "audit_package"
  ],
  "schema_status": "reported_valid",
  "integrity": {
    "algorithm": "sha256",
    "evidence_id": "trajectory-evidence://routine/assemble-render-match",
    "hash_match": true
  },
  "release_limitations": [
    "predecessor_revision_only",
    "visible_release_limits"
  ],
  "redactions_applied": [
    "research_content_removed",
    "identity_details_removed",
    "runtime_metadata_removed",
    "interaction_content_removed",
    "local_identifiers_replaced",
    "integrity_values_replaced",
    "uncleared_artifacts_removed"
  ],
  "contains_research_payload": false,
  "contains_session_metadata": false
}
