{
  "schema_version": "1.0.0",
  "record_type": "agent",
  "public_id": "claim-bounty-delivery/release-quality-reviewer",
  "record_uri": "trajectory://agent/claim-bounty-delivery/release-quality-reviewer",
  "evidence_grade": "exact",
  "source_revision_relation": "predecessor",
  "summary": "Checked completeness, format consistency, replay, accessibility, privacy, licensing, and release scope.",
  "status": "represented",
  "outcome": null,
  "proves_current_revision_end_to_end_completion": false,
  "timestamps": {
    "started_at_utc": null,
    "finished_at_utc": null
  },
  "step_order": [
    {
      "position": 1,
      "public_step_id": "check-and-package-audit",
      "status": "represented"
    }
  ],
  "retry_count": null,
  "correction_count": null,
  "handoffs": {
    "received_from": [
      "claim-bounty-delivery/audit-report-builder"
    ],
    "delivered_to": [
      "claim-bounty-operations/claimbounty-orchestrator"
    ]
  },
  "input_classes": [
    "sanitized_workflow_state"
  ],
  "bounded_errors": [],
  "output_artifact_kinds": [
    "release_gates",
    "audit_package"
  ],
  "schema_status": "not_reported",
  "integrity": {
    "algorithm": null,
    "evidence_id": null,
    "hash_match": null
  },
  "release_limitations": [
    "predecessor_revision_only",
    "visible_release_limits"
  ],
  "redactions_applied": [
    "research_content_removed",
    "identity_details_removed",
    "runtime_metadata_removed",
    "interaction_content_removed",
    "local_identifiers_replaced",
    "integrity_values_replaced",
    "uncleared_artifacts_removed"
  ],
  "contains_research_payload": false,
  "contains_session_metadata": false
}
