{
  "schema_version": "1.0.0",
  "record_type": "agent",
  "public_id": "claim-bounty-delivery/audit-report-builder",
  "record_uri": "trajectory://agent/claim-bounty-delivery/audit-report-builder",
  "evidence_grade": "exact",
  "source_revision_relation": "predecessor",
  "summary": "Built canonical and rendered outputs, corrected renderer selection, checked deterministic rendering, and ran clean replay.",
  "status": "represented",
  "outcome": null,
  "proves_current_revision_end_to_end_completion": false,
  "timestamps": {
    "started_at_utc": null,
    "finished_at_utc": null
  },
  "step_order": [
    {
      "position": 1,
      "public_step_id": "build-canonical-audit",
      "status": "represented"
    },
    {
      "position": 2,
      "public_step_id": "render-researcher-html",
      "status": "represented"
    }
  ],
  "retry_count": null,
  "correction_count": 1,
  "handoffs": {
    "received_from": [
      "claim-bounty-verification/scientific-adjudicator"
    ],
    "delivered_to": [
      "claim-bounty-delivery/release-quality-reviewer"
    ]
  },
  "input_classes": [
    "sanitized_workflow_state"
  ],
  "bounded_errors": [],
  "output_artifact_kinds": [
    "audit_json",
    "audit_html",
    "replay_package"
  ],
  "schema_status": "not_reported",
  "integrity": {
    "algorithm": null,
    "evidence_id": null,
    "hash_match": null
  },
  "release_limitations": [
    "predecessor_revision_only"
  ],
  "redactions_applied": [
    "research_content_removed",
    "identity_details_removed",
    "runtime_metadata_removed",
    "interaction_content_removed",
    "local_identifiers_replaced",
    "integrity_values_replaced",
    "uncleared_artifacts_removed"
  ],
  "contains_research_payload": false,
  "contains_session_metadata": false
}
