{
  "schema_version": "1.0.0",
  "record_type": "agent",
  "public_id": "claim-bounty-robustness/robustness-lead",
  "record_uri": "trajectory://agent/claim-bounty-robustness/robustness-lead",
  "evidence_grade": "equivalent_predecessor",
  "source_revision_relation": "predecessor",
  "summary": "Froze estimand rules, joined result-blind lanes, resolved admissibility, built the robustness map, and accepted one bounded correction.",
  "status": "represented",
  "outcome": null,
  "proves_current_revision_end_to_end_completion": false,
  "timestamps": {
    "started_at_utc": null,
    "finished_at_utc": null
  },
  "step_order": [
    {
      "position": 1,
      "public_step_id": "freeze-sensitivity-contract",
      "status": "represented"
    },
    {
      "position": 2,
      "public_step_id": "rank-sensitivity-candidates",
      "status": "represented"
    },
    {
      "position": 3,
      "public_step_id": "resolve-candidate-admissibility",
      "status": "represented"
    },
    {
      "position": 4,
      "public_step_id": "build-robustness-map",
      "status": "represented"
    }
  ],
  "retry_count": null,
  "correction_count": 1,
  "handoffs": {
    "received_from": [
      "claim-bounty-robustness/data-choices-analyst",
      "claim-bounty-robustness/model-and-covariate-analyst",
      "claim-bounty-robustness/inference-analyst",
      "claim-bounty-verification/blind-method-reviewer-alpha",
      "claim-bounty-verification/blind-method-reviewer-beta"
    ],
    "delivered_to": [
      "claim-bounty-verification/verification-lead"
    ]
  },
  "input_classes": [
    "sanitized_workflow_state"
  ],
  "bounded_errors": [],
  "output_artifact_kinds": [
    "robustness_map"
  ],
  "schema_status": "not_reported",
  "integrity": {
    "algorithm": null,
    "evidence_id": null,
    "hash_match": null
  },
  "release_limitations": [
    "predecessor_revision_only"
  ],
  "redactions_applied": [
    "research_content_removed",
    "identity_details_removed",
    "runtime_metadata_removed",
    "interaction_content_removed",
    "local_identifiers_replaced",
    "integrity_values_replaced",
    "uncleared_artifacts_removed"
  ],
  "contains_research_payload": false,
  "contains_session_metadata": false
}
