{
  "schema_version": "1.0.0",
  "record_type": "agent",
  "public_id": "research-and-insights/literature-searcher",
  "record_uri": "trajectory://agent/research-and-insights/literature-searcher",
  "evidence_grade": "reconstructed",
  "source_revision_relation": "predecessor",
  "summary": "Ran three bounded search lanes and handed a screened registry to extraction.",
  "status": "represented",
  "outcome": null,
  "proves_current_revision_end_to_end_completion": false,
  "timestamps": {
    "started_at_utc": null,
    "finished_at_utc": null
  },
  "step_order": [
    {
      "position": 1,
      "public_step_id": "search-screen-slice-sources",
      "status": "represented"
    }
  ],
  "retry_count": null,
  "correction_count": null,
  "handoffs": {
    "received_from": [
      "research-and-insights/researcher"
    ],
    "delivered_to": [
      "research-and-insights/source-extractor"
    ]
  },
  "input_classes": [
    "sanitized_workflow_state"
  ],
  "bounded_errors": [],
  "output_artifact_kinds": [
    "screened_registry"
  ],
  "schema_status": "not_reported",
  "integrity": {
    "algorithm": null,
    "evidence_id": null,
    "hash_match": null
  },
  "release_limitations": [
    "reconstructed_from_sanitized_inventory"
  ],
  "redactions_applied": [
    "research_content_removed",
    "identity_details_removed",
    "runtime_metadata_removed",
    "interaction_content_removed",
    "local_identifiers_replaced",
    "integrity_values_replaced",
    "uncleared_artifacts_removed"
  ],
  "contains_research_payload": false,
  "contains_session_metadata": false
}
