{
  "schema_version": "1.0.0",
  "record_type": "routine",
  "public_id": "build-and-freeze-study-case",
  "record_uri": "trajectory://routine/build-and-freeze-study-case",
  "evidence_grade": "exact",
  "source_revision_relation": "current",
  "summary": "The current revision mapped the bounded target, preserved a document conflict, and froze the case with visible limits.",
  "status": "completed_with_limits",
  "outcome": "case_frozen_with_limits",
  "proves_current_revision_end_to_end_completion": false,
  "timestamps": {
    "started_at_utc": "2026-08-30T19:33:32Z",
    "finished_at_utc": "2026-08-30T19:55:51Z"
  },
  "step_order": [
    {
      "position": 1,
      "public_step_id": "validate-claim-map-documents",
      "status": "completed"
    },
    {
      "position": 2,
      "public_step_id": "map-target-data",
      "status": "completed"
    },
    {
      "position": 3,
      "public_step_id": "map-target-code",
      "status": "completed"
    },
    {
      "position": 4,
      "public_step_id": "verify-document-consistency",
      "status": "completed"
    },
    {
      "position": 5,
      "public_step_id": "bind-and-freeze-analysis",
      "status": "completed"
    }
  ],
  "retry_count": null,
  "correction_count": null,
  "handoffs": {
    "received_from": [
      "run-claimbounty-scientific-audit"
    ],
    "delivered_to": [
      "reproduce-original-result"
    ]
  },
  "input_classes": [
    "audit_request",
    "scientific_policy",
    "case_bundle"
  ],
  "bounded_errors": [],
  "output_artifact_kinds": [
    "frozen_study_case"
  ],
  "schema_status": "not_reported",
  "integrity": {
    "algorithm": null,
    "evidence_id": null,
    "hash_match": null
  },
  "release_limitations": [
    "nonblocking_document_conflict"
  ],
  "redactions_applied": [
    "research_content_removed",
    "identity_details_removed",
    "runtime_metadata_removed",
    "interaction_content_removed",
    "local_identifiers_replaced",
    "integrity_values_replaced",
    "uncleared_artifacts_removed"
  ],
  "contains_research_payload": false,
  "contains_session_metadata": false
}
